Ituri,17-05-2026,Initial sensitisation of community and religious leaders to counter rumours of 'mystical disease'. Draft of Military Governor's message on EVD prevention being developed. Educational messages developed by target audience on disease prevention.
Ituri,19-05-2026,"Sensitisation of 56 TB patients (7 women) in Mudzi-Maria health area. Sensitisation of 26 CAC members (12 women) in Kasegwa health area to activate home visits in all avenues and villages. Briefing of 23 PRESICODESA of Bunia HZ on RCCE. Capacity strengthening by central level on daily report writing for the pillar secretariat team. Broadcast of the Provincial Military Governor's message on compliance with EVD control measures via various channels (radio, schools, social media). Advocacy meetings with the Provincial Government Spokesperson, Governorate's head of communication and State Protocol Service chief. 5 advocacy meetings: with Provincial EPST division head Orientale 1, Youth division head, provincial Gender/Family/Child division head, FARDC commander in Mangala HZ, Ituri provincial committee of traditional healers — to prevent pupils being expelled from schools for lack of masks, mobilise youth organisations and women's associations in community engagement. Promotion of the local toll-free number (0821419595)."
Ituri,20-05-2026,"Communication plan being developed. Production of provisional communication timelines. Production of two official messages (one for preparedness, one for response). Communication session for provincial government officials during morning parade. Briefing of PRESICODESA on strengthening CBS, RCCE, alert reporting and community feedback collection. First rumour and community-feedback analysis meeting held. Advocacy with Mayor of Bunia to ban funeral wakes during EVD response. Advocacy with Bunia Sub-PROVED EPST to relay instruction banning expulsion of pupils for lack of masks. Advocacy with commander of Bunia Civil Aviation Authority (RVA)."
Ituri,22-05-2026,"Advocacy with mayors of Shari, Nyakasanza and Mbunya communes for their engagement in support of EVD response communication activities. Briefing of 19 service chiefs operating at Bunia airport (15 men, 4 women) on EVD and prevention measures in public settings. Sensitisation of 38 livestock breeders and wholesalers at Bunia industrial slaughterhouse (16 women, 22 men) on EVD preventive measures. Educational talk with 30 women during CPS session on EVD preventive measures (Bunia HZ, Bigo AS)."
North-Kivu,05-06-2026,"19,832 people sensitised; 3,221 households visited through the involvement of 658 community health workers (RECO); 813 community leaders committed; 46 community alerts reported and 1 rumour clarified; 18 local radios engaged with 3 formats produced and broadcast."
South-Kivu,05-06-2026,"Mass sensitisation of 405 final-year students at the ENAFEP centre in Kabunga on EVD prevention measures and signs. Advocacy meeting in Kahungu village (EVD epicentre) with 40 youth leaders, women leaders, school representatives and religious leaders on their involvement in the fight against EVD. 6,961 people sensitised and 1,567 households visited."
Ituri,05-06-2026,"Sensitisation of 45 economic operators (FEC, including 12 women) on EVD preventive measures in their workplaces (shops, boutiques, markets, etc.) and in their homes. Start of sensitisation to support patient admission and isolation at Nyankunde ETC (finding: no patient resistance to isolation). Sensitisation of FARDC military personnel in the TSERE operational sector (Rwampara HZ) during the morning parade."
North-Kivu,06-06-2026,"Briefing of 19 community leaders and CODESA members of AS Kirima on community-based surveillance and ownership of EVD preventive measures; briefing of HZ management committee members on RCCE; 7 educational talks on CBS and EVD prevention reaching 361 people (175 women, 186 men) — members of mutuals, youth associations, motorcyclists, prayer groups in AS Mbimbi, Mabasele, Mambabeka, Pakanza; 2,454 people sensitised during home visits (1,232 men, 1,222 women)."
South-Kivu,06-06-2026,Mass sensitisation of 78 people (46 women) at Katana market on prevention measures and EVD signs; educational talk with 19 motorcycle-taxi drivers at Kavumu centre (Miti-Murhesa HZ); harmonisation of the community-relay briefing module.
Ituri,06-06-2026,"42 women representatives from three communes of Bunia municipality briefed on EVD preventive measures at the market and their homes (emphasis on IPC, correct handwashing, adherence to safe burials); feedback analysis revealed community complaints about low service availability (late safe burials, weak handling of alerts notified by community actors and the helpline, low availability of decontamination teams, low availability of care — especially nutritional — driving multiple escapes); 7 mass sensitisations organised in 7 affected HZ on EVD preventive measures (1,210 people reached)."
North-Kivu,07-06-2026,"255 community actors (Goma and surroundings) trained and briefed, including religious leaders, traditional healers, military personnel, healthcare providers, motorcyclists, municipal agents, RECOs, ACSAs and church leaders on risk communication, community engagement, community surveillance and rumour management. 7 rumours clarified and multiple community feedbacks documented on EVD existence, disease origin, mask use, vaccines and ETCs. 45 grassroots leaders in Mondo AS/Katwa HZ briefed on EVD generalities and community perception. 78 community leaders (45 M, 33 F) briefed on risk communication and community alert reporting."
South-Kivu,07-06-2026,"Advocacy with 40 leaders from Chiranga, Kalengane and Kabushwa health areas (Katana HZ) and Lwiro, Kahungu and Chaoboka (Mitimurhesa HZ) on their involvement in the fight against EVD. Support for briefing of 150 community relays on the EVD package, communication techniques and CREC interventions around cases to help break transmission chains in Mitimurhesa and Katana HZs. 7 alerts raised (4 in Mitimurhesa HZ, 3 in Katana HZ including 1 death)."
Ituri,07-06-2026,"During his Sunday visit to CME Nyankunde where an ETC is installed, the Military Governor encouraged EVD patients and their families to adhere to isolation practice at the ETC. The INSP Director-General asked the 17 health zone medical chiefs of the Bunia office and their Community Animators to get involved in EVD response activities (call made at the launch of training on the zonal approach). 10 mass sensitisation sessions organised, 1,819 people reached in 7 HZs on EVD preventive measures, importance of SDB, community alert reporting, etc. During home visits in 592 households, 3,738 people (1,450 M, 2,122 F, 65 boys, 101 girls) were sensitised for behaviour change thanks to 58 community relays deployed in the field."
North-Kivu,08-06-2026,"13,251 people sensitised on EVD prevention through door-to-door and mass activities; 7,589 households visited including 3,200 with two visits and practical demonstration (hand washing, temperature checking, safe handling) reaching more than 30,356 people; 974 community relays mobilised; 212 community actors briefed on RCCE, SBC and infodemic management; 15 alerts reported (12 validated within 48h, 3 under verification) in addition to one rumour clarified with community feedback; 50 community radio stations broadcast three formats on EVD prevention measures."
South-Kivu,08-06-2026,"Mass sensitisation of 1,252 schoolchildren (637 boys and 615 girls) at Kabunga primary school in Kavumu health area/Mitimurhesa HZ on EVD prevention measures and signs; advocacy with 23 teachers and a school director to intensify sensitisation in schools; briefing of 14 young U-reporter volunteers on RCCE interventions around cases in Kahungu health area/Mitimurhesa HZ affected by EVD; 10 radio stations broadcast EVD prevention messages; 640 community leaders and relays committed to supporting public health actions in Mitimurhesa health zone."
Ituri,08-06-2026,"Organisation of a community dialogue between the INSP Director-General and religious leaders of Bunia city; 177 people reached including 80 (40 community actors from Bunia HZ and 49 community relays from Rwampara HZ) during the briefing on EVD preventive measures and community-based surveillance and 97 religious leaders (47 women included) during a training on EVD preventive measures in religious settings; 2 advocacy sessions organised with 20 people in Bunia HZ (10 people: market chiefs of BIGO, Yambi Yaya, Nyakasanza) and Nizi HZ (10 people: chief of the LOPA displacement site) respectively around their involvement in EVD prevention activities in public places and their adherence to the response (including contact follow-up); 5 mass sensitisation sessions organised, 385 people reached (187 M and 161 F) in 7 HZs with themes on EVD preventive measures, importance of SDB, community alert reporting, etc. Community feedback: (i) A voice message accompanied by a photo and messages from a deceased doctor (confirmed Ebola case) yesterday at CME, went viral creating countless negative comments on the quality and reliability of EVD care centres; (ii) several truck drivers identified belonging to a tribe often refuse hand washing at the TCHAY checkpoint and spread messages denying the disease. Recommendations have been formulated for adequate and targeted responses."
North-Kivu,09-06-2026,"11,303 people sensitized. 5,080 households visited (24,671 people). 649 community relays mobilized (12/20 health areas). 340 briefed, 212 students sensitized. 25 alerts, 3 rumors clarified. 18 radio stations engaged."
South-Kivu,09-06-2026,399 schoolchildren sensitized (Panzi and Bwindi). Briefing of 45 community and religious leaders (Ibanda). Posting of EBOLA communication materials in Bukavu.
Ituri,09-06-2026,"Alert raised by a traditional healer (suspected case escaped from Mongbwalu). Broadcast of testimonies of recovered patients from Nyankunde. 15 community dialogues (125 people). 9 mass sensitizations (3,108 people). 4 advocacy meetings in Rwampara (25 people)."
